id,instruction_target_image,instruction_prompt,source,translate,category,object,,
edit_713,image_edit_magic_data/image_713.png,change the background to a beach,image_edit_meta,将背景更改为海滩,Background,无修改物体,,
edit_714,image_edit_magic_data/image_714.png,change background to futuristic cityscape,image_edit_meta,更换背景为未来城市景观,Background,无修改物体,,
edit_715,image_edit_magic_data/image_715.png,Replace the background with a cityscape at sunset,image_edit_meta,将背景替换为日落时的城市天际线。,Background,无修改物体,,
edit_716,image_edit_magic_data/image_716.png,create a studio background,image_edit_meta,创建一个摄影棚背景,Background,无修改物体,,
edit_717,image_edit_magic_data/image_717.png,set the background to sunset,image_edit_meta,将背景设置为日落。,Background,无修改物体,,
edit_718,image_edit_magic_data/image_718.png,change the background to beach,image_edit_meta,将背景更改为海滩,Background,无修改物体,,
edit_719,image_edit_magic_data/image_719.png,change the background to Taj Mahal,image_edit_meta,将背景更改为泰姬陵,Background,无修改物体,,
edit_720,image_edit_magic_data/image_720.png,transform the background into a modern office space,image_edit_meta,将背景转换成现代办公空间。,Background,无修改物体,,
edit_721,image_edit_magic_data/image_721.png,change the background to a modern cityscape,image_edit_meta,将背景更改为现代城市景观。,Background,无修改物体,,
edit_722,image_edit_magic_data/image_722.png,replace the background with a luxury mansion,image_edit_meta,请将背景替换为豪华别墅。,Background,无修改物体,,
edit_723,image_edit_magic_data/image_723.png,change the background to cityscape,image_edit_meta,将背景更改为城市风光,Background,无修改物体,,
edit_724,image_edit_magic_data/image_724.png,convert the background into a magical forest,image_edit_meta,请将背景转换为魔法森林。,Background,无修改物体,,
edit_725,image_edit_magic_data/image_725.png,alter the background to tropical island,image_edit_meta,将背景改为热带岛屿,Background,无修改物体,,
edit_726,image_edit_magic_data/image_726.png,make the background souk,image_edit_meta,将背景变为喧闹的集市,Background,无修改物体,,
edit_727,image_edit_magic_data/image_727.png,make the background galaxy,image_edit_meta,将背景设置为银河系。,Background,无修改物体,,
edit_728,image_edit_magic_data/image_728.png,alter the background to a luxurious villa,image_edit_meta,将背景改为豪华别墅,Background,无修改物体,,
edit_729,image_edit_magic_data/image_729.png,use a starry night sky as the background,image_edit_meta,请使用繁星点点的夜空作为背景。,Background,无修改物体,,
edit_730,image_edit_magic_data/image_730.png,change the background to amusement park,image_edit_meta,将背景更改为游乐园,Background,无修改物体,,
edit_731,image_edit_magic_data/image_731.png,set the background to Taj Mahal,image_edit_meta,将背景设置为泰姬陵,Background,无修改物体,,
edit_732,image_edit_magic_data/image_732.png,change the background to a bustling city street,image_edit_meta,将背景更改为繁忙的城市街道。,Background,无修改物体,,
edit_733,image_edit_magic_data/image_733.png,change background to mountain,image_edit_meta,更换背景为山景,Background,无修改物体,,
edit_734,image_edit_magic_data/image_734.png,add a cityscape background,image_edit_meta,添加城市天际线背景,Background,无修改物体,,
edit_735,image_edit_magic_data/image_735.png,shift the background to a trendy boutique hotel lobby,image_edit_meta,将背景转换为时尚精品酒店大堂,Background,无修改物体,,
edit_736,image_edit_magic_data/image_736.png,make the background a cityscape at sunset,image_edit_meta,将背景设为日落时的城市天际线。,Background,无修改物体,,
edit_737,image_edit_magic_data/image_737.png,replace the background with a luxury car showroom,image_edit_meta,请将背景替换为豪华汽车展示厅。,Background,无修改物体,,
edit_738,image_edit_magic_data/image_738.png,use a beach as the background,image_edit_meta,使用海滩作为背景,Background,无修改物体,,
edit_739,image_edit_magic_data/image_739.png,transform the background into a peaceful meadow,image_edit_meta,将背景转换为宁静的草地,Background,无修改物体,,
edit_740,image_edit_magic_data/image_740.png,update the background to a winter wonderland,image_edit_meta,请将背景更新为冬季仙境。,Background,无修改物体,,
edit_741,image_edit_magic_data/image_741.png,alter the background to cityscape,image_edit_meta,将背景更改为城市风光,Background,无修改物体,,
edit_742,image_edit_magic_data/image_742.png,modify the background to beach at sunset,image_edit_meta,请将背景修改为夕阳下的海滩。,Background,无修改物体,,
edit_743,image_edit_magic_data/image_743.png,swap the background to library,image_edit_meta,将背景换成图书馆,Background,无修改物体,,
edit_744,image_edit_magic_data/image_744.png,replace the background with a city skyline,image_edit_meta,请将背景替换为城市天际线。,Background,无修改物体,,
edit_745,image_edit_magic_data/image_745.png,replace the background with a dog park,image_edit_meta,请将背景替换为狗狗公园。,Background,无修改物体,,
edit_746,image_edit_magic_data/image_746.png,make the background a beach,image_edit_meta,将背景设为海滩,Background,无修改物体,,
edit_747,image_edit_magic_data/image_747.png,set the background to beach,image_edit_meta,将背景设置为海滩,Background,无修改物体,,
edit_748,image_edit_magic_data/image_748.png,turn rice field into beach,image_edit_meta,把稻田变成海滩,Global,稻田,,
edit_749,image_edit_magic_data/image_749.png,make the daughters into sons,image_edit_meta,把女儿变成儿子,Local,女儿,,
edit_750,image_edit_magic_data/image_750.png,transform tree into cactus,image_edit_meta,将树变成仙人掌。,Local,树,,
edit_751,image_edit_magic_data/image_751.png,have the pen be made of candy.,image_edit_meta,请把笔做成糖果的。,Local,笔,,
edit_752,image_edit_magic_data/image_752.png,make him have short hair,image_edit_meta,让他留短发,Local,头发,,
edit_753,image_edit_magic_data/image_753.png,turn puppy into kitten,image_edit_meta,将小狗变成小猫,Local,小狗,,
edit_754,image_edit_magic_data/image_754.png,make them look like they're from the 1920s,image_edit_meta,让他们看起来像是来自1920年代。,Global,无修改物体,,
edit_755,image_edit_magic_data/image_755.png,replace vineyards with wheat fields,image_edit_meta,将葡萄园替换为麦田,Local,葡萄园,,
edit_756,image_edit_magic_data/image_756.png,replace the bar with a beach,image_edit_meta,把酒吧换成海滩,Local,酒吧,,
edit_757,image_edit_magic_data/image_757.png,replace grapes with broccoli,image_edit_meta,请将葡萄换成西兰花。,Local,葡萄,,
edit_758,image_edit_magic_data/image_758.png,make her hair black,image_edit_meta,把她的头发染成黑色。,Local,头发,,
edit_759,image_edit_magic_data/image_759.png,have him to wear a suit instead of hat and tattoo,image_edit_meta,请让他穿西装而不是戴帽子和纹身。,Local,帽子和纹身,,
edit_760,image_edit_magic_data/image_760.png,make the cup into a mug.,image_edit_meta,把杯子做成马克杯。,Local,杯子,,
edit_761,image_edit_magic_data/image_761.png,switch dog with cat,image_edit_meta,将狗换成猫。,Local,狗,,
edit_762,image_edit_magic_data/image_762.png,turn soldiers into animals,image_edit_meta,将士兵变成动物,Local,士兵,,
edit_763,image_edit_magic_data/image_763.png,change men to women.,image_edit_meta,将男性改为女性。,Local,男性,,
edit_764,image_edit_magic_data/image_764.png,switch corset to jacket,image_edit_meta,将紧身胸衣转换成夹克,Local,紧身胸衣,,
edit_765,image_edit_magic_data/image_765.png,replace canoes with spaceships,image_edit_meta,将独木舟替换为宇宙飞船,Local,独木舟,,
edit_766,image_edit_magic_data/image_766.png,give him a mohawk.,image_edit_meta,给他理个莫西干发型。,Local,头发,,
edit_767,image_edit_magic_data/image_767.png,convert boy to girl,image_edit_meta,将男孩转换为女孩,Local,男孩,,
edit_768,image_edit_magic_data/image_768.png,change city to beach,image_edit_meta,改变城市到海滩,Background,无修改物体,,
edit_769,image_edit_magic_data/image_769.png,replace girl with boy,image_edit_meta,将女孩替换为男孩,Local,女孩,,
edit_770,image_edit_magic_data/image_770.png,change glasses to sunglasses,image_edit_meta,将眼镜换成太阳镜。,Local,眼睛,,
edit_771,image_edit_magic_data/image_771.png,make the pancakes look like pizza,image_edit_meta,让煎饼看起来像披萨。,Local,煎饼,,
edit_772,image_edit_magic_data/image_772.png,change the saree to a modern dress,image_edit_meta,将衣服改成现代连衣裙,Local,衣服,,
edit_773,image_edit_magic_data/image_773.png,replace boy with a seal,image_edit_meta,将男孩替换为海豹,Local,男孩,,
edit_774,image_edit_magic_data/image_774.png,switch wooden plate to a white plate,image_edit_meta,将木制盘子换成白色盘子,Local,木制盘子,,
edit_775,image_edit_magic_data/image_775.png,replace lamb with beef,image_edit_meta,将羊肉换成牛肉,Local,羊肉,,
edit_776,image_edit_magic_data/image_776.png,colorize the photo,image_edit_meta,将照片彩色化,Global,无修改物体,,
edit_777,image_edit_magic_data/image_777.png,replace the girl's clothes with a traditional greek dress,image_edit_meta,请将女孩的衣服换成传统的希腊长裙。,Local,女孩的衣服,,
edit_778,image_edit_magic_data/image_778.png,colorize the uniform,image_edit_meta,将制服着色,Local,制服,,
edit_779,image_edit_magic_data/image_779.png,paint the cookies rainbow,image_edit_meta,将饼干涂成彩虹色,Local,饼干,,
edit_780,image_edit_magic_data/image_780.png,paint the tree blue,image_edit_meta,把树涂成蓝色。,Local,树,,
edit_781,image_edit_magic_data/image_781.png,remove the beard,image_edit_meta,剃掉胡须,Remove,胡须,,
edit_782,image_edit_magic_data/image_782.png,make her eyes green,image_edit_meta,让她的的眼睛变成绿色。,Local,她的眼睛,,
edit_783,image_edit_magic_data/image_783.png,make the raincoat bright yellow,image_edit_meta,请把雨衣做成鲜黄色。,Local,雨衣,,
edit_784,image_edit_magic_data/image_784.png,make the braids blonde,image_edit_meta,把辫子染成金色。,Local,辫子,,
edit_785,image_edit_magic_data/image_785.png,make the pocket watch silver,image_edit_meta,将怀表制成银色。,Local,怀表,,
edit_786,image_edit_magic_data/image_786.png,change the coat to a dress,image_edit_meta,把大衣换成连衣裙,Local,大衣,,
edit_787,image_edit_magic_data/image_787.png,cover the girls with a coat of glitter,image_edit_meta,用一层闪光粉覆盖女孩们,Addition,无修改物体,,
edit_788,image_edit_magic_data/image_788.png,cover the house with vines,image_edit_meta,用藤蔓覆盖房子,Addition,无修改物体,,
edit_789,image_edit_magic_data/image_789.png,make their t-shirts green,image_edit_meta,请把他们的T恤做成绿色。,Local,T恤,,
edit_790,image_edit_magic_data/image_790.png,make the buttons gold,image_edit_meta,将按钮变为金色。,Local,按钮,,
edit_791,image_edit_magic_data/image_791.png,change the car to a modern one,image_edit_meta,把汽车换成现代款式的,Local,汽车,,
edit_792,image_edit_magic_data/image_792.png,paint the hair blue,image_edit_meta,把头发染成蓝色,Local,头发,,
edit_793,image_edit_magic_data/image_793.png,paint the women's outfits bright colors,image_edit_meta,将女性的服装涂成鲜艳的颜色。,Local,女性的服装,,
edit_794,image_edit_magic_data/image_794.png,make the man smile,image_edit_meta,让那个男人笑。,Local,男人,,
edit_795,image_edit_magic_data/image_795.png,make the tracksuit blue,image_edit_meta,请将运动服做成蓝色。,Local,运动服,,
edit_796,image_edit_magic_data/image_796.png,replace the girl's hair with a rainbow,image_edit_meta,请将女孩的头发变为彩虹色。,Local,女孩的头发,,
edit_797,image_edit_magic_data/image_797.png,make his horns bigger,image_edit_meta,让他的角变大,Local,角,,
edit_798,image_edit_magic_data/image_798.png,replace the mop with a rainbow,image_edit_meta,拖把替换为彩虹色,Local,拖把,,
edit_799,image_edit_magic_data/image_799.png,cover the monk's robe with a colorful pattern,image_edit_meta,用彩色图案覆盖僧袍,Local,僧袍,,
edit_800,image_edit_magic_data/image_800.png,make the fur coat into a cape,image_edit_meta,将皮草外套改制成斗篷。,Local,皮草外套,,
edit_801,image_edit_magic_data/image_801.png,cover the Christmas tree with glitter,image_edit_meta,用闪光片装饰圣诞树,Addition,无修改物体,,
edit_802,image_edit_magic_data/image_802.png,replace the cat with a dog,image_edit_meta,请将猫换成狗。,Local,猫,,
edit_803,image_edit_magic_data/image_803.png,make the gorilla and lion disappear,image_edit_meta,让大猩猩和狮子消失,Remove,大猩猩，狮子,,
edit_804,image_edit_magic_data/image_804.png,color the leaves blue,image_edit_meta,将树叶涂成蓝色。,Local,树叶,,
edit_805,image_edit_magic_data/image_805.png,make her blouse red,image_edit_meta,把她的上衣变成红色。,Local,上衣,,
edit_806,image_edit_magic_data/image_806.png,get rid of the dogs,image_edit_meta,请把狗赶走。,Remove,狗,,
edit_807,image_edit_magic_data/image_807.png,get rid of the smoke and bokeh,image_edit_meta,去除烟雾和焦外成像,Global,无修改物体,,
edit_808,image_edit_magic_data/image_808.png,replace the headphones with a pair of wings,image_edit_meta,用一对翅膀替换耳机。,Local,耳机,,
edit_809,image_edit_magic_data/image_809.png,make her lips bright red.,image_edit_meta,把她的嘴唇涂成鲜红色。,Local,嘴唇,,
edit_810,image_edit_magic_data/image_810.png,make the balloons silver,image_edit_meta,请把气球做成银色。,Local,气球,,
edit_811,image_edit_magic_data/image_811.png,make the backpack red,image_edit_meta,请把背包变成红色。,Local,背包,,
edit_812,image_edit_magic_data/image_812.png,cover the wheelchair with flowers,image_edit_meta,用鲜花装饰轮椅,Addition,无修改物体,,
edit_813,image_edit_magic_data/image_813.png,change the dresses to black and white,image_edit_meta,将裙子换成黑白两色。,Local,裙子,,
edit_814,image_edit_magic_data/image_814.png,fill the room with water,image_edit_meta,请将房间注满水。,Addition,无修改物体,,
edit_815,image_edit_magic_data/image_815.png,color the girl's hair and eyes with similar shades of blue,image_edit_meta,用相似的蓝色给女孩的头发和眼睛上色。,Local,女孩的头发和眼睛,,
edit_816,image_edit_magic_data/image_816.png,make the sofa green,image_edit_meta,把沙发变成绿色。,Local,沙发,,
edit_817,image_edit_magic_data/image_817.png,paint her short hair blue,image_edit_meta,把她的短发染成蓝色。,Local,她的短发,,
edit_818,image_edit_magic_data/image_818.png,put a red coat on the girl,image_edit_meta,请给女孩穿上红色的外套。,Addition,无修改物体,,
edit_819,image_edit_magic_data/image_819.png,paint the girl's shirt blue,image_edit_meta,把女孩的衬衫涂成蓝色。,Local,女孩的衬衫,,
edit_820,image_edit_magic_data/image_820.png,change the color of the wig to blue,image_edit_meta,将假发的颜色改为蓝色。,Local,假发,,
edit_821,image_edit_magic_data/image_821.png,make her dress green,image_edit_meta,把她的裙子染成绿色。,Local,裙子,,
edit_822,image_edit_magic_data/image_822.png,cover the church with gold,image_edit_meta,将教堂覆盖上金子,Addition,无修改物体,,
edit_823,image_edit_magic_data/image_823.png,color the fruit juice bright pink,image_edit_meta,将果汁染成鲜艳的粉红色。,Local,果汁,,
edit_824,image_edit_magic_data/image_824.png,make the bottle and booties blue,image_edit_meta,请把瓶子和小靴子做成蓝色的。,Local,瓶子，小靴子,,
edit_825,image_edit_magic_data/image_825.png,make the leaf green,image_edit_meta,使叶子变绿,Local,叶子,,
edit_826,image_edit_magic_data/image_826.png,make the doll's suit red,image_edit_meta,请把娃娃的衣服做成红色。,Local,娃娃的衣服,,
edit_827,image_edit_magic_data/image_827.png,place a vase on the table,image_edit_meta,在桌子上放一个花瓶。,Addition,无修改物体,,
edit_828,image_edit_magic_data/image_828.png,coat the girl's lips with glitter,image_edit_meta,用闪光粉涂女孩的嘴唇,Local,女孩的嘴唇,,
edit_829,image_edit_magic_data/image_829.png,dye the hair purple,image_edit_meta,把头发染成紫色。,Local,头发,,
edit_830,image_edit_magic_data/image_830.png,make the credit card gold,image_edit_meta,将信用卡升级为金卡,Local,信用卡,,
edit_831,image_edit_magic_data/image_831.png,make the horse's fur pink,image_edit_meta,把马的毛发染成粉色。,Local,马的毛发,,
edit_832,image_edit_magic_data/image_832.png,replace the night club with a beach,image_edit_meta,将夜总会替换为海滩。,Background,无修改物体,,
edit_833,image_edit_magic_data/image_833.png,fill the pool with juice,image_edit_meta,请把游泳池里装满果汁。,Addition,无修改物体,,
edit_834,image_edit_magic_data/image_834.png,cover the picture with glitter,image_edit_meta,用亮片覆盖图片,Global,无修改物体,,
edit_835,image_edit_magic_data/image_835.png,paint the woman's jacket and scarf green,image_edit_meta,将女士的夹克和围巾涂成绿色。,Local,女士的夹克，围巾,,
edit_836,image_edit_magic_data/image_836.png,make the flower green,image_edit_meta,把花变成绿色。,Local,花,,
edit_837,image_edit_magic_data/image_837.png,paint the dress blue,image_edit_meta,把裙子涂成蓝色。,Local,裙子,,
edit_838,image_edit_magic_data/image_838.png,make her hair straight,image_edit_meta,把她的头发拉直,Local,头发,,
edit_839,image_edit_magic_data/image_839.png,dye the flag blue,image_edit_meta,把旗子染成蓝色。,Local,旗子,,
edit_840,image_edit_magic_data/image_840.png,remove the red lips and freckles,image_edit_meta,请去掉红唇和雀斑。,Remove,红唇和雀斑,,
edit_841,image_edit_magic_data/image_841.png,remove the veil,image_edit_meta,揭开面纱,Remove,面纱,,
edit_842,image_edit_magic_data/image_842.png,remove the dog,image_edit_meta,把狗弄走,Remove,狗,,
edit_843,image_edit_magic_data/image_843.png,get rid of the car,image_edit_meta,处理掉汽车,Remove,汽车,,
edit_844,image_edit_magic_data/image_844.png,make the dog a cat,image_edit_meta,把狗变成猫,Local,狗,,
edit_845,image_edit_magic_data/image_845.png,replace the girl with a boy,image_edit_meta,请将女孩换成男孩。,Local,女孩,,
edit_846,image_edit_magic_data/image_846.png,cover the unicorns with glitter,image_edit_meta,用闪光粉覆盖独角兽。,Addition,无修改物体,,
edit_847,image_edit_magic_data/image_847.png,coat the girl in a yellow jacket,image_edit_meta,请给女孩穿上一件黄色的夹克。,Addition,无修改物体,,
edit_848,image_edit_magic_data/image_848.png,put a golden crown on the woman's head,image_edit_meta,请为这位女士戴上金色的王冠。,Addition,无修改物体,,
edit_849,image_edit_magic_data/image_849.png,make her clothes orange,image_edit_meta,把她的衣服染成橙色。,Local,她的衣服,,
edit_850,image_edit_magic_data/image_850.png,replace the cathedral with a giant pineapple,image_edit_meta,请将大教堂替换为一个巨大的菠萝。,Local,大教堂,,
edit_851,image_edit_magic_data/image_851.png,make the suit sparkly,image_edit_meta,让这套西装闪闪发光,Local,这套西装,,
edit_852,image_edit_magic_data/image_852.png,make the car pink,image_edit_meta,把汽车涂成粉色。,Local,汽车,,
edit_853,image_edit_magic_data/image_853.png,change her shirt to green,image_edit_meta,请把她的衬衫换成绿色。,Local,衬衫,,
edit_854,image_edit_magic_data/image_854.png,color the mirror frame gold,image_edit_meta,将镜子的边框涂成金色。,Local,镜子的边框,,
edit_855,image_edit_magic_data/image_855.png,change the sari to a modern dress,image_edit_meta,把纱丽改换成现代连衣裙,Local,纱丽,,
edit_856,image_edit_magic_data/image_856.png,paint the woman's shirt purple,image_edit_meta,把女人的衬衫涂成紫色。,Local,女人的衬衫,,
edit_857,image_edit_magic_data/image_857.png,color the blanket orange,image_edit_meta,请将毯子涂成橙色。,Local,毯子,,
edit_858,image_edit_magic_data/image_858.png,colorize the woman's face with a golden tone,image_edit_meta,请用金色调为女士的脸部上色。,Local,女士的脸部,,
edit_859,image_edit_magic_data/image_859.png,dye her hair a vibrant purple,image_edit_meta,把她的头发染成鲜艳的紫色。,Local,头发,,
edit_860,image_edit_magic_data/image_860.png,cover the girl with a veil,image_edit_meta,用面纱遮住女孩。,Addition,无修改物体,,
edit_861,image_edit_magic_data/image_861.png,fill the glasses with candy canes,image_edit_meta,请用拐杖糖装满玻璃杯。,Addition,无修改物体,,
edit_862,image_edit_magic_data/image_862.png,make the woman's hair blonde,image_edit_meta,把女人的头发染成金色。,Local,女人的头发,,
edit_863,image_edit_magic_data/image_863.png,fill the couple's clothes with polka dots,image_edit_meta,请将这对夫妇的衣服上添满波点。,Local,衣服,,
edit_864,image_edit_magic_data/image_864.png,make him smile,image_edit_meta,让他笑,Local,他,,
edit_865,image_edit_magic_data/image_865.png,make the cake pink,image_edit_meta,请把蛋糕做成粉色。,Local,蛋糕,,
edit_866,image_edit_magic_data/image_866.png,add a Santa hat to the man,image_edit_meta,请给这位男士加上一顶圣诞帽。,Addition,无修改物体,,
edit_867,image_edit_magic_data/image_867.png,remove the bird,image_edit_meta,请把那只鸟移走。,Remove,鸟,,
edit_868,image_edit_magic_data/image_868.png,get rid of the blue stripe,image_edit_meta,去掉蓝色条纹,Remove,蓝色条纹,,
edit_869,image_edit_magic_data/image_869.png,get rid of the tattoos,image_edit_meta,去掉纹身,Remove,纹身,,
edit_870,image_edit_magic_data/image_870.png,remove one of the women,image_edit_meta,请移除其中一名女性。,Remove,一名女性,,
edit_871,image_edit_magic_data/image_871.png,remove the statue,image_edit_meta,移除雕像,Remove,雕像,,
edit_872,image_edit_magic_data/image_872.png,remove the cat,image_edit_meta,把猫删除,Remove,猫,,
edit_873,image_edit_magic_data/image_873.png,remove the water bottle,image_edit_meta,取下水瓶,Remove,水瓶,,
edit_874,image_edit_magic_data/image_874.png,remove the beard and the cap,image_edit_meta,摘掉胡须和帽子,Remove,胡须，帽子,,
edit_875,image_edit_magic_data/image_875.png,remove the cockatiel,image_edit_meta,请把鸡尾鹦鹉移走。,Remove,鸡尾鹦鹉,,
edit_876,image_edit_magic_data/image_876.png,get rid of the flower,image_edit_meta,扔掉那朵花,Remove,花,,
edit_877,image_edit_magic_data/image_877.png,without the village,image_edit_meta,删除村庄,Remove,村庄,,
edit_878,image_edit_magic_data/image_878.png,get rid of the painting,image_edit_meta,扔掉那幅画,Remove,那幅画,,
edit_879,image_edit_magic_data/image_879.png,remove the sunglasses and the glass of whiskey,image_edit_meta,请摘下墨镜和手中的威士忌酒杯。,Remove,墨镜，威士忌酒杯。,,
edit_880,image_edit_magic_data/image_880.png,get rid of the robot,image_edit_meta,去掉机器人,Remove,机器人,,
edit_881,image_edit_magic_data/image_881.png,remove the yellow sneakers,image_edit_meta,请把黄色的运动鞋拿走。,Remove,黄色的运动鞋,,
edit_882,image_edit_magic_data/image_882.png,remove the red coat,image_edit_meta,请把红色的外套脱掉。,Remove,红色的外套,,
edit_883,image_edit_magic_data/image_883.png,eliminate the dragon,image_edit_meta,消灭龙,Remove,龙,,
edit_884,image_edit_magic_data/image_884.png,remove the sunset,image_edit_meta,移除日落,Remove,日落,,
edit_885,image_edit_magic_data/image_885.png,get rid of the car,image_edit_meta,处理掉汽车,Remove,汽车,,
edit_886,image_edit_magic_data/image_886.png,remove the bow,image_edit_meta,请把这个蝴蝶结拿掉。,Remove,蝴蝶结,,
edit_887,image_edit_magic_data/image_887.png,remove the dog,image_edit_meta,把狗弄走,Remove,狗,,
edit_888,image_edit_magic_data/image_888.png,erase the face masks,image_edit_meta,摘掉口罩,Remove,口罩,,
edit_889,image_edit_magic_data/image_889.png,remove the barn owl,image_edit_meta,请把仓鸮赶走。,Remove,仓鸮,,
edit_890,image_edit_magic_data/image_890.png,remove the bun and the picnic,image_edit_meta,把面包和野餐拿开,Remove,面包，野餐,,
edit_891,image_edit_magic_data/image_891.png,get rid of the young man,image_edit_meta,摆脱那个年轻人,Remove,年轻人,,
edit_892,image_edit_magic_data/image_892.png,remove the jacket,image_edit_meta,脱掉夹克,Remove,夹克,,
edit_893,image_edit_magic_data/image_893.png,without the glasses,image_edit_meta,请摘下眼镜,Remove,眼镜,,
edit_894,image_edit_magic_data/image_894.png,remove the Pomeranian,image_edit_meta,请把那只博美犬移走。,Remove,博美犬,,
edit_895,image_edit_magic_data/image_895.png,remove the mango salsa,image_edit_meta,请去掉芒果莎莎酱。,Remove,芒果莎莎酱,,
edit_896,image_edit_magic_data/image_896.png,remove the male,image_edit_meta,移除雄性,Remove,雄性,,
