id,instruction_target_image,instruction_prompt,source,translate,category,object,,
edit_541,image_edit_magic_data/image_541.png,change the background to construction site,image_edit_meta,将背景更改为建筑工地。,Background,无修改物体,,
edit_542,image_edit_magic_data/image_542.png,change the background to a vineyard,image_edit_meta,将背景更改为葡萄园,Background,无修改物体,,
edit_543,image_edit_magic_data/image_543.png,change the background to a cozy coffee shop,image_edit_meta,将背景更改为舒适的咖啡店。,Background,无修改物体,,
edit_544,image_edit_magic_data/image_544.png,replace the background with a futuristic cityscape,image_edit_meta,请将背景替换为未来城市的天际线。,Background,无修改物体,,
edit_545,image_edit_magic_data/image_545.png,replace the background with a city skyline,image_edit_meta,请将背景替换为城市天际线。,Background,无修改物体,,
edit_546,image_edit_magic_data/image_546.png,transform the background into a luxury hotel lobby,image_edit_meta,将背景转换为豪华酒店大堂。,Background,无修改物体,,
edit_547,image_edit_magic_data/image_547.png,set the background to beach,image_edit_meta,将背景设置为海滩,Background,无修改物体,,
edit_548,image_edit_magic_data/image_548.png,set the background to a vintage car garage,image_edit_meta,将背景设置为复古汽车车库。,Background,无修改物体,,
edit_549,image_edit_magic_data/image_549.png,change the background to urban cityscape,image_edit_meta,将背景更改为都市城市景观。,Background,无修改物体,,
edit_550,image_edit_magic_data/image_550.png,relocate the scene to a beach,image_edit_meta,将场景转移到海滩上。,Background,无修改物体,,
edit_551,image_edit_magic_data/image_551.png,replace the background with a vintage car,image_edit_meta,将背景替换为一辆复古汽车。,Background,无修改物体,,
edit_552,image_edit_magic_data/image_552.png,make the background sunset.,image_edit_meta,将背景设置为夕阳。,Background,无修改物体,,
edit_553,image_edit_magic_data/image_553.png,transform the background into a royal palace,image_edit_meta,把背景变成皇宫,Background,无修改物体,,
edit_554,image_edit_magic_data/image_554.png,change the background to winter wonderland,image_edit_meta,将背景更改为冬季仙境,Background,无修改物体,,
edit_555,image_edit_magic_data/image_555.png,set the background to dark cityscape,image_edit_meta,将背景设置为暗夜城市风光,Background,无修改物体,,
edit_556,image_edit_magic_data/image_556.png,transform the background into Taj Mahal,image_edit_meta,将背景转换为泰姬陵,Background,无修改物体,,
edit_557,image_edit_magic_data/image_557.png,replace the background with cityscape at night,image_edit_meta,请将背景替换为夜间的都市风光。,Background,无修改物体,,
edit_558,image_edit_magic_data/image_558.png,make the background colorful and playful,image_edit_meta,请把背景弄得多彩而有趣。,Background,无修改物体,,
edit_559,image_edit_magic_data/image_559.png,replace the background with a cityscape at sunset,image_edit_meta,请将背景替换为夕阳下的城市天际线。,Background,无修改物体,,
edit_560,image_edit_magic_data/image_560.png,replace the background with a living room,image_edit_meta,请将背景替换为客厅。,Background,无修改物体,,
edit_561,image_edit_magic_data/image_561.png,change the background to a desert,image_edit_meta,将背景更改为沙漠。,Background,无修改物体,,
edit_562,image_edit_magic_data/image_562.png,replace the background with a starry night sky,image_edit_meta,请将背景替换为星空夜景。,Background,无修改物体,,
edit_563,image_edit_magic_data/image_563.png,let's see it in a futuristic setting,image_edit_meta,让我们在未来的设定中看看它。,Global,无修改物体,,
edit_564,image_edit_magic_data/image_564.png,make the pool water green,image_edit_meta,把游泳池的水变绿,Local,游泳池,,
edit_565,image_edit_magic_data/image_565.png,remove the fish,image_edit_meta,请把鱼拿走。,Remove,鱼,,
edit_566,image_edit_magic_data/image_566.png,Set the background to outer space,image_edit_meta,将背景设置为外太空。,Background,无修改物体,,
edit_567,image_edit_magic_data/image_567.png,change the background to a colorful abstract design,image_edit_meta,将背景更改为多彩的抽象设计。,Background,无修改物体,,
edit_568,image_edit_magic_data/image_568.png,make the background a playroom,image_edit_meta,将背景设置为游戏室,Background,无修改物体,,
edit_569,image_edit_magic_data/image_569.png,modify the background to a winter wonderland,image_edit_meta,请将背景修改为冬季仙境。,Background,无修改物体,,
edit_570,image_edit_magic_data/image_570.png,replace the background with a spooky haunted house,image_edit_meta,请将背景替换为幽灵出没的恐怖鬼屋。,Background,无修改物体,,
edit_571,image_edit_magic_data/image_571.png,replace the background with a peaceful beach,image_edit_meta,请将背景替换为宁静的海滩。,Background,无修改物体,,
edit_572,image_edit_magic_data/image_572.png,set the background to a fashion runway,image_edit_meta,将背景设置为时装秀跑道。,Background,无修改物体,,
edit_573,image_edit_magic_data/image_573.png,make the background snowy mountain,image_edit_meta,将背景变为雪山,Background,无修改物体,,
edit_574,image_edit_magic_data/image_574.png,swap the background to a peaceful village,image_edit_meta,将背景换成宁静的村庄,Background,无修改物体,,
edit_575,image_edit_magic_data/image_575.png,replace the background with a peaceful nature scene,image_edit_meta,请将背景替换为宁静的自然风光。,Background,无修改物体,,
edit_576,image_edit_magic_data/image_576.png,alter the background to beach,image_edit_meta,将背景改为海滩,Background,无修改物体,,
edit_577,image_edit_magic_data/image_577.png,make the background a beach,image_edit_meta,将背景设为海滩,Background,无修改物体,,
edit_578,image_edit_magic_data/image_578.png,set the background to a beach,image_edit_meta,将背景设置为海滩。,Background,无修改物体,,
edit_579,image_edit_magic_data/image_579.png,Transport the background to a magical forest,image_edit_meta,将背景转移到魔法森林,Background,无修改物体,,
edit_580,image_edit_magic_data/image_580.png,change the background to a desert oasis,image_edit_meta,将背景更改为沙漠绿洲。,Background,无修改物体,,
edit_581,image_edit_magic_data/image_581.png,"replace the background with a cute,  colorful pattern",image_edit_meta,请将背景替换为可爱、多彩的图案。,Background,无修改物体,,
edit_582,image_edit_magic_data/image_582.png,replace the background with beach,image_edit_meta,将背景替换为海滩,Background,无修改物体,,
edit_583,image_edit_magic_data/image_583.png,replace the background with beauty salon,image_edit_meta,请将背景替换为美容院。,Background,无修改物体,,
edit_584,image_edit_magic_data/image_584.png,change the background to a baseball field,image_edit_meta,将背景更改为棒球场。,Background,无修改物体,,
edit_585,image_edit_magic_data/image_585.png,change the background to a modern laundry room,image_edit_meta,将背景改为现代洗衣房,Background,无修改物体,,
edit_586,image_edit_magic_data/image_586.png,replace the background with a luxury hotel lobby,image_edit_meta,请将背景替换为豪华酒店大堂。,Background,无修改物体,,
edit_587,image_edit_magic_data/image_587.png,make the background sunset,image_edit_meta,将背景设置为夕阳,Background,无修改物体,,
edit_588,image_edit_magic_data/image_588.png,change the background to a garden,image_edit_meta,将背景更改为花园,Background,无修改物体,,
edit_589,image_edit_magic_data/image_589.png,make the background a haunted mansion,image_edit_meta,将背景设置为幽灵鬼屋。,Background,无修改物体,,
edit_590,image_edit_magic_data/image_590.png,replace the background with a luxury hotel lobby,image_edit_meta,请将背景替换为豪华酒店大堂。,Background,无修改物体,,
edit_591,image_edit_magic_data/image_591.png,set the background to winter wonderland,image_edit_meta,将背景设置为冬季仙境,Background,无修改物体,,
edit_592,image_edit_magic_data/image_592.png,make the background a luxury hotel lobby,image_edit_meta,将背景设置为豪华酒店大堂,Background,无修改物体,,
edit_593,image_edit_magic_data/image_593.png,make the background a romantic dinner setting,image_edit_meta,将背景设置为浪漫晚餐场景,Background,无修改物体,,
edit_594,image_edit_magic_data/image_594.png,change the background to cityscape,image_edit_meta,将背景更改为城市风光,Background,无修改物体,,
edit_595,image_edit_magic_data/image_595.png,convert the background to magical forest,image_edit_meta,将背景转换为魔法森林。,Background,无修改物体,,
edit_596,image_edit_magic_data/image_596.png,change the background to an urban cityscape,image_edit_meta,将背景更改为都市城市景观。,Background,无修改物体,,
edit_597,image_edit_magic_data/image_597.png,replace the background with cityscape,image_edit_meta,请将背景替换为城市风光。,Background,无修改物体,,
edit_598,image_edit_magic_data/image_598.png,transform the background into a modern art gallery,image_edit_meta,将背景转换成现代艺术画廊,Background,无修改物体,,
edit_599,image_edit_magic_data/image_599.png,modify the background to a luxurious wedding venue,image_edit_meta,请将背景修改为豪华婚礼场地。,Background,无修改物体,,
edit_600,image_edit_magic_data/image_600.png,"alter the background to a dark,  mystical forest",image_edit_meta,将背景改为阴暗神秘的森林。,Background,无修改物体,,
edit_601,image_edit_magic_data/image_601.png,replace the background with a vibrant colorful background,image_edit_meta,请将背景替换为鲜艳多彩的背景。,Background,无修改物体,,
edit_602,image_edit_magic_data/image_602.png,replace the background with a Valentine's Day theme.,image_edit_meta,请将背景替换为情人节主题。,Background,无修改物体,,
edit_603,image_edit_magic_data/image_603.png,modify the background to gym,image_edit_meta,请将背景修改为健身房。,Background,无修改物体,,
edit_604,image_edit_magic_data/image_604.png,move the background to cityscape,image_edit_meta,将背景更改为城市风光,Background,无修改物体,,
edit_605,image_edit_magic_data/image_605.png,change the background to a bright and colorful street art,image_edit_meta,将背景更改为明亮且多彩的街头艺术。,Background,无修改物体,,
edit_606,image_edit_magic_data/image_606.png,replace the background with futuristic cityscape,image_edit_meta,请将背景替换为未来城市景象。,Background,无修改物体,,
edit_607,image_edit_magic_data/image_607.png,replace the background with a cityscape at sunset,image_edit_meta,请将背景替换为夕阳下的城市天际线。,Background,无修改物体,,
edit_608,image_edit_magic_data/image_608.png,change the background to an urban cityscape,image_edit_meta,将背景更改为都市城市景观。,Background,无修改物体,,
edit_609,image_edit_magic_data/image_609.png,make the background a nursery rhyme scene,image_edit_meta,将背景设置为童谣场景。,Background,无修改物体,,
edit_610,image_edit_magic_data/image_610.png,change the background to a modern office,image_edit_meta,将背景更改为现代办公室。,Background,无修改物体,,
edit_611,image_edit_magic_data/image_611.png,modify the background to a cityscape at sunset,image_edit_meta,将背景更改为夕阳下的城市天际线。,Background,无修改物体,,
edit_612,image_edit_magic_data/image_612.png,make the background a cozy bedroom,image_edit_meta,将背景设置成一个温馨的卧室。,Background,无修改物体,,
edit_613,image_edit_magic_data/image_613.png,make the background fantasy themed,image_edit_meta,将背景设置为幻想主题,Background,无修改物体,,
edit_614,image_edit_magic_data/image_614.png,transform background to futuristic cityscape,image_edit_meta,将背景转换为未来都市景观,Background,无修改物体,,
edit_615,image_edit_magic_data/image_615.png,transition the background to a cozy restaurant,image_edit_meta,将背景转换为舒适的餐厅,Background,无修改物体,,
edit_616,image_edit_magic_data/image_616.png,change the background to cityscape,image_edit_meta,将背景更改为城市风光,Background,无修改物体,,
edit_617,image_edit_magic_data/image_617.png,replace the background with a cozy mountain lodge,image_edit_meta,请将背景替换为舒适的山间小屋。,Background,无修改物体,,
edit_618,image_edit_magic_data/image_618.png,replace the background with a stage,image_edit_meta,请将背景替换为舞台。,Background,无修改物体,,
edit_619,image_edit_magic_data/image_619.png,modify the background to a colorful and playful environment,image_edit_meta,请将背景修改为多彩且富有童趣的环境。,Background,无修改物体,,
edit_620,image_edit_magic_data/image_620.png,replace the background with a romantic sunset,image_edit_meta,请将背景替换为浪漫的日落。,Background,无修改物体,,
edit_621,image_edit_magic_data/image_621.png,replace the background with a spaceship,image_edit_meta,请将背景替换为宇宙飞船。,Background,无修改物体,,
edit_622,image_edit_magic_data/image_622.png,change the background to futuristic cityscape,image_edit_meta,将背景更改为未来城市景象,Background,无修改物体,,
edit_623,image_edit_magic_data/image_623.png,replace the background with snowy mountain.,image_edit_meta,请将背景替换为雪山。,Background,无修改物体,,
edit_624,image_edit_magic_data/image_624.png,make the background an eerie forest,image_edit_meta,将背景设置为幽暗森林。,Background,无修改物体,,
edit_625,image_edit_magic_data/image_625.png,transport the background to beachside,image_edit_meta,将背景转移到海边,Background,无修改物体,,
edit_626,image_edit_magic_data/image_626.png,change background to luxury cruise ship,image_edit_meta,更换背景为豪华游轮,Background,无修改物体,,
edit_627,image_edit_magic_data/image_627.png,shift the background to a luxury boutique hotel,image_edit_meta,将背景转换为豪华精品酒店,Background,无修改物体,,
edit_628,image_edit_magic_data/image_628.png,change the background to luxury hotel lobby,image_edit_meta,将背景更改为豪华酒店大堂。,Background,无修改物体,,
edit_629,image_edit_magic_data/image_629.png,change the background to a cozy living room,image_edit_meta,将背景更改为舒适的客厅。,Background,无修改物体,,
edit_630,image_edit_magic_data/image_630.png,replace the background with space,image_edit_meta,请将背景替换为太空。,Background,无修改物体,,
edit_631,image_edit_magic_data/image_631.png,shift the background to a colorful festival,image_edit_meta,将背景转变为多彩的节日氛围,Background,无修改物体,,
edit_632,image_edit_magic_data/image_632.png,swap the background with a luxury mansion,image_edit_meta,将背景换成豪华别墅,Background,无修改物体,,
edit_633,image_edit_magic_data/image_633.png,alter the background to a peaceful Japanese garden,image_edit_meta,将背景改为宁静的日本花园。,Background,无修改物体,,
edit_634,image_edit_magic_data/image_634.png,change the background to a beach at sunset,image_edit_meta,将背景更改为海滩日落。,Background,无修改物体,,
edit_635,image_edit_magic_data/image_635.png,adorn the background with a beautiful garden,image_edit_meta,用美丽的花园装饰背景,Background,无修改物体,,
edit_636,image_edit_magic_data/image_636.png,add a starry night sky background,image_edit_meta,添加星空夜景背景,Background,无修改物体,,
edit_637,image_edit_magic_data/image_637.png,swap the background with a modern cityscape,image_edit_meta,将背景替换为现代城市景观,Background,无修改物体,,
edit_638,image_edit_magic_data/image_638.png,remove the chicken and vegetables,image_edit_meta,取出鸡肉和蔬菜。,Remove,鸡肉和蔬菜,,
edit_639,image_edit_magic_data/image_639.png,get rid of the sword,image_edit_meta,扔掉那把剑,Remove,剑,,
edit_640,image_edit_magic_data/image_640.png,remove the chicken,image_edit_meta,去掉鸡肉,Remove,鸡肉,,
edit_641,image_edit_magic_data/image_641.png,remove the statue of a monk,image_edit_meta,请移除和尚的雕像。,Remove,和尚的雕像,,
edit_642,image_edit_magic_data/image_642.png,get rid of the sword,image_edit_meta,扔掉那把剑,Remove,剑,,
edit_643,image_edit_magic_data/image_643.png,remove the boy,image_edit_meta,把男孩删除,Remove,男孩,,
edit_644,image_edit_magic_data/image_644.png,get rid of the bag,image_edit_meta,把袋子扔掉,Remove,袋子,,
edit_645,image_edit_magic_data/image_645.png,remove the sunset,image_edit_meta,移除日落,Remove,太阳,,
edit_646,image_edit_magic_data/image_646.png,remove the turban,image_edit_meta,摘下头巾,Remove,头巾,,
edit_647,image_edit_magic_data/image_647.png,remove the snake and the tattoo,image_edit_meta,移除蛇和纹身,Remove,蛇，纹身,,
edit_648,image_edit_magic_data/image_648.png,get rid of the tattoo,image_edit_meta,去掉纹身,Remove,纹身,,
edit_649,image_edit_magic_data/image_649.png,get rid of the young man,image_edit_meta,摆脱那个年轻人,Remove,年轻人,,
edit_650,image_edit_magic_data/image_650.png,remove the make-up,image_edit_meta,卸妆,Remove,妆造,,
edit_651,image_edit_magic_data/image_651.png,remove the father,image_edit_meta,除去父亲,Remove,父亲,,
edit_652,image_edit_magic_data/image_652.png,remove the bicycle,image_edit_meta,移除自行车,Remove,自行车,,
edit_653,image_edit_magic_data/image_653.png,get rid of the dragon image and the wooden table,image_edit_meta,去掉龙的图案和木头桌子。,Remove,龙的图案和木头桌子,,
edit_654,image_edit_magic_data/image_654.png,remove the stand,image_edit_meta,请将支架拆除。,Remove,支架,,
edit_655,image_edit_magic_data/image_655.png,remove the street,image_edit_meta,移除街道,Remove,街道,,
edit_656,image_edit_magic_data/image_656.png,remove the cup of tea,image_edit_meta,请拿走那杯茶。,Remove,茶,,
edit_657,image_edit_magic_data/image_657.png,remove the blocks,image_edit_meta,移除障碍物,Remove,障碍物,,
edit_658,image_edit_magic_data/image_658.png,erase the cafe,image_edit_meta,擦除咖啡馆,Remove,咖啡馆,,
edit_659,image_edit_magic_data/image_659.png,remove the medical mask and the stack of books,image_edit_meta,请摘下医用口罩和那叠书。,Remove,医用口罩和书,,
edit_660,image_edit_magic_data/image_660.png,get rid of the mobile phone,image_edit_meta,扔掉手机,Remove,手机,,
edit_661,image_edit_magic_data/image_661.png,remove the hourglass,image_edit_meta,移除沙漏,Remove,沙漏,,
edit_662,image_edit_magic_data/image_662.png,remove the car,image_edit_meta,移走汽车,Remove,汽车,,
edit_663,image_edit_magic_data/image_663.png,remove the rock,image_edit_meta,移除石头,Remove,石头,,
edit_664,image_edit_magic_data/image_664.png,remove the grandmother,image_edit_meta,请把祖母移走。,Remove,祖母,,
edit_665,image_edit_magic_data/image_665.png,remove the earrings,image_edit_meta,摘掉耳环,Remove,耳环,,
edit_666,image_edit_magic_data/image_666.png,get rid of the flowers,image_edit_meta,扔掉这些花,Remove,花,,
edit_667,image_edit_magic_data/image_667.png,remove autumn,image_edit_meta,清除秋天的元素,Background,无修改物体,,
edit_668,image_edit_magic_data/image_668.png,get rid of the glasses and the beard,image_edit_meta,摘掉眼镜，刮掉胡子。,Remove,眼镜和胡子,,
edit_669,image_edit_magic_data/image_669.png,remove the japanese garden,image_edit_meta,请把日本花园移除。,Background,无修改物体,,
edit_670,image_edit_magic_data/image_670.png,delete the leopard shark,image_edit_meta,删除豹纹鲨,Remove,豹纹鲨,,
edit_671,image_edit_magic_data/image_671.png,remove the candy cane,image_edit_meta,请拿掉拐杖糖。,Remove,拐杖糖,,
edit_672,image_edit_magic_data/image_672.png,get rid of the gold glasses,image_edit_meta,扔掉那副金色眼镜,Remove,金色眼镜,,
edit_673,image_edit_magic_data/image_673.png,without the cup,image_edit_meta,删除杯子,Remove,杯子,,
edit_674,image_edit_magic_data/image_674.png,remove the swimming pool,image_edit_meta,拆除游泳池,Remove,游泳池,,
edit_675,image_edit_magic_data/image_675.png,remove the beard and cap,image_edit_meta,剃掉胡须和帽子。,Remove,胡须，帽子,,
edit_676,image_edit_magic_data/image_676.png,delete the mural,image_edit_meta,删除壁画,Remove,壁画,,
edit_677,image_edit_magic_data/image_677.png,take out the gnomes,image_edit_meta,请把小矮人拿出来。,Remove,小矮人,,
edit_678,image_edit_magic_data/image_678.png,erase the picture of the palm tree,image_edit_meta,擦除棕榈树的图片,Remove,棕榈树,,
edit_679,image_edit_magic_data/image_679.png,remove the bouquet of dried flowers,image_edit_meta,请把那束干花拿走。,Remove,那束干花,,
edit_680,image_edit_magic_data/image_680.png,remove the rain,image_edit_meta,去掉雨水,Global,无修改物体,,
edit_681,image_edit_magic_data/image_681.png,remove the confetti,image_edit_meta,请清除五彩纸屑。,Remove,五彩纸屑,,
edit_682,image_edit_magic_data/image_682.png,remove the ANZAC Bridge,image_edit_meta,移除澳新军团大桥,Remove,澳新军团大桥,,
edit_683,image_edit_magic_data/image_683.png,take out the glitter,image_edit_meta,取出闪光粉,Remove,闪光粉,,
edit_684,image_edit_magic_data/image_684.png,remove the cabbage,image_edit_meta,请把卷心菜拿走。,Remove,卷心菜,,
edit_685,image_edit_magic_data/image_685.png,remove the golden jewelry set,image_edit_meta,请取下金质首饰套装。,Remove,金质首饰套装,,
edit_686,image_edit_magic_data/image_686.png,remove the clouds,image_edit_meta,驱散云朵,Remove,云,,
edit_687,image_edit_magic_data/image_687.png,remove one of the bikers,image_edit_meta,请移除一名骑手。,Remove,骑手,,
edit_688,image_edit_magic_data/image_688.png,without the sea,image_edit_meta,去掉海,Remove,海,,
edit_689,image_edit_magic_data/image_689.png,remove the bicycle,image_edit_meta,移除自行车,Remove,自行车,,
edit_690,image_edit_magic_data/image_690.png,remove the girl,image_edit_meta,请把这个女孩带走。,Remove,女孩,,
edit_691,image_edit_magic_data/image_691.png,without the accessories,image_edit_meta,不要附加配件。,Remove,配件,,
edit_692,image_edit_magic_data/image_692.png,remove the long hair,image_edit_meta,去除长发,Remove,长发,,
edit_693,image_edit_magic_data/image_693.png,get rid of the horse,image_edit_meta,摆脱那匹马,Remove,马,,
edit_694,image_edit_magic_data/image_694.png,delete the plants in vase and the books,image_edit_meta,请清理花瓶里的植物和书籍。,Remove,植物和书籍,,
edit_695,image_edit_magic_data/image_695.png,remove the dragon statue and the winter,image_edit_meta,请移除龙雕像,Remove,龙雕像,,
edit_696,image_edit_magic_data/image_696.png,remove the piercings and blue hair,image_edit_meta,去掉耳环和蓝色的头发。,Remove,耳环和蓝色的头发,,
edit_697,image_edit_magic_data/image_697.png,get rid of the guitar,image_edit_meta,扔掉吉他,Remove,吉他,,
edit_698,image_edit_magic_data/image_698.png,remove the red caviar,image_edit_meta,请去掉红鱼子酱。,Remove,红鱼子酱,,
edit_699,image_edit_magic_data/image_699.png,get rid of the barn,image_edit_meta,去掉谷仓,Remove,谷仓,,
edit_700,image_edit_magic_data/image_700.png,switch the background to a modern cityscape,image_edit_meta,将背景切换到现代城市景观。,Background,无修改物体,,
edit_701,image_edit_magic_data/image_701.png,cut the purple iris flowers,image_edit_meta,剪下紫色的鸢尾花,Remove,紫色的鸢尾花,,
edit_702,image_edit_magic_data/image_702.png,remove the hamburger,image_edit_meta,移除汉堡,Remove,汉堡,,
edit_703,image_edit_magic_data/image_703.png,get rid of the fish,image_edit_meta,去掉鱼。,Remove,鱼,,
edit_704,image_edit_magic_data/image_704.png,get rid of the cricket bat,image_edit_meta,扔掉板球拍,Remove,板球拍,,
edit_705,image_edit_magic_data/image_705.png,remove the glasses and the red lipstick,image_edit_meta,请摘下眼镜并擦去红色口红。,Remove,眼镜和红色口红,,
edit_706,image_edit_magic_data/image_706.png,remove one of the dogs,image_edit_meta,请把其中一只狗移走。,Remove,狗,,
edit_707,image_edit_magic_data/image_707.png,get rid of the braids,image_edit_meta,去掉辫子,Remove,辫子,,
edit_708,image_edit_magic_data/image_708.png,get rid of the bouquet,image_edit_meta,扔掉花束,Remove,花束,,
edit_709,image_edit_magic_data/image_709.png,remove the jewellery and traditional makeup,image_edit_meta,摘下珠宝首饰和传统妆容,Remove,珠宝首饰和传统妆容,,
edit_710,image_edit_magic_data/image_710.png,remove the coffee mug,image_edit_meta,请把咖啡杯拿走。,Remove,咖啡杯,,
edit_711,image_edit_magic_data/image_711.png,swap the background to a luxury yacht,image_edit_meta,将背景换成豪华游艇,Background,无修改物体,,
edit_712,image_edit_magic_data/image_712.png,make the background a luxury pet spa,image_edit_meta,将背景设置为豪华宠物水疗中心,Background,无修改物体,,
